{
  "$schema": "https://json-schema.org/draft/2020-12/schema",
  "$id": "https://example.invalid/enterprise-agent-system/inception-telemetry-flow.v1.schema.json",
  "title": "Inception Telemetry Flow Candidate",
  "type": "object",
  "additionalProperties": false,
  "required": ["schema_version", "flow_id", "classification", "stages", "exporter", "storage", "retention", "training_use_policy", "state", "claims_not_proven"],
  "properties": {
    "schema_version": {"const": "enterprise-agent-system/inception-telemetry-flow/v1"},
    "flow_id": {"type": "string", "minLength": 1},
    "classification": {"enum": ["PUBLIC", "INTERNAL", "CONFIDENTIAL", "RESTRICTED"]},
    "stages": {
      "type": "array",
      "minItems": 4,
      "uniqueItems": true,
      "items": {"enum": ["CLASSIFY", "SANITIZE", "NEGATIVE_LEAK_CONTROLS", "EXPORT", "STORE", "DELETE"]}
    },
    "exporter": {
      "type": "object",
      "additionalProperties": false,
      "required": ["subject", "version", "allowlisted_destination"],
      "properties": {
        "subject": {"type": "string", "minLength": 1},
        "version": {"type": "string", "minLength": 1},
        "allowlisted_destination": {"type": "string", "minLength": 1}
      }
    },
    "storage": {"type": "string", "minLength": 1},
    "retention": {"type": "string", "minLength": 1},
    "training_use_policy": {"enum": ["PROHIBITED", "HUMAN_REVIEW_REQUIRED", "UNKNOWN"]},
    "state": {"enum": ["CANDIDATE", "BLOCKED", "UNKNOWN", "HUMAN_REVIEW_REQUIRED", "EXPIRED"]},
    "claims_not_proven": {"type": "array", "minItems": 1, "uniqueItems": true, "items": {"type": "string", "minLength": 1}}
  }
}
